project,issue_number,issue_type,text,classification,indicator,zz_created,zz_updated,zz_resolved,zz_duration,zz_text,zz_wink_a,zz_wink_b,roberta
hadoop,12811,description,The HBase's HMaster port number conflicts with Hadoop kms port number. Both uses 16000. There might be use cases user need kms and HBase present on the same cluster. The HBase is able to encrypt its HFiles but user might need KMS to encrypt other HDFS directories. Users would have to manually override the default port of either application on their cluster. It would be nice to have different default ports so kms and HBase could naturally coexist.,design_debt,non-optimal_design,"Wed, 17 Feb 2016 00:12:23 +0000","Thu, 12 May 2016 18:22:07 +0000","Thu, 14 Apr 2016 18:36:47 +0000",4991064,The HBase's HMaster port number conflicts with Hadoop kms port number. Both uses 16000. There might be use cases user need kms and HBase present on the same cluster. The HBase is able to encrypt its HFiles but user might need KMS to encrypt other HDFS directories. Users would have to manually override the default port of either application on their cluster. It would be nice to have different default ports so kms and HBase could naturally coexist.,-0.00825,-0.00825,neutral
hadoop,12946,description,"Ensure at most one JVMPauseMonitor thread is running per JVM when there are multiple JVMPauseMonitor instances, e.g., in mini clusters. This will prevent redundant GC pause log messages while still maintaining one monitor thread running. This is a different way to fix HADOOP-12855.",design_debt,non-optimal_design,"Sun, 20 Mar 2016 18:14:55 +0000","Tue, 10 Jan 2017 01:41:24 +0000","Tue, 10 Jan 2017 01:41:24 +0000",25514789,"Ensure at most one JVMPauseMonitor thread is running per JVM when there are multiple JVMPauseMonitor instances, e.g., in mini clusters. This will prevent redundant GC pause log messages while still maintaining one monitor thread running. This is a different way to fix HADOOP-12855.",0.08016666667,0.08016666667,neutral
hadoop,13365,description,"While we are mucking with all of the _OPTS variables, this is a good time to convert them to arrays so that filesystems with spaces in them can be used.",design_debt,non-optimal_design,"Mon, 11 Jul 2016 15:06:56 +0000","Sat, 1 Sep 2018 20:06:01 +0000","Sat, 1 Sep 2018 20:06:01 +0000",67582745,"While we are mucking with all of the _OPTS variables, this is a good time to convert them to arrays so that filesystems with spaces in them can be used.",0.625,0.625,neutral
hadoop,13770,description,"creates a bash shell command to verify if the system supports bash. However, its error message is misleading, and the logic should be updated. If the shell command throws an IOException, it does not imply the bash did not run successfully. If the shell command process was interrupted, its internal logic throws an which is a subclass of IOException. An example of it appeared in a recent jenkins job The test logic in starts a thread, wait it for 1 second, and interrupt the thread, expecting the thread to terminate. However, the method swallowed the interrupt, and therefore failed. The original design is not desirable, as it swallowed a potential interrupt, causing to fail. Unfortunately, Java does not allow this static method to throw exception. We should removed the static member variable, so that the method can throw the interrupt exception. The node manager should call the static method, instead of using the static member variable. This fix has an associated benefit: the tests could run faster, because it will no longer need to spawn a bash process when it uses a Shell static method variable (which happens quite often for checking what operating system Hadoop is running on)",design_debt,non-optimal_design,"Wed, 16 Dec 2015 22:28:18 +0000","Wed, 2 Oct 2019 17:14:23 +0000","Fri, 28 Oct 2016 15:11:22 +0000",27362584,"Shell.checkIsBashSupported() creates a bash shell command to verify if the system supports bash. However, its error message is misleading, and the logic should be updated. If the shell command throws an IOException, it does not imply the bash did not run successfully. If the shell command process was interrupted, its internal logic throws an InterruptedIOException, which is a subclass of IOException. An example of it appeared in a recent jenkins job https://builds.apache.org/job/PreCommit-HADOOP-Build/8257/testReport/org.apache.hadoop.ipc/TestRPCWaitForProxy/testInterruptedWaitForProxy/ The test logic in TestRPCWaitForProxy.testInterruptedWaitForProxy starts a thread, wait it for 1 second, and interrupt the thread, expecting the thread to terminate. However, the method Shell.checkIsBashSupported swallowed the interrupt, and therefore failed. The original design is not desirable, as it swallowed a potential interrupt, causing TestRPCWaitForProxy.testInterruptedWaitForProxy to fail. Unfortunately, Java does not allow this static method to throw exception. We should removed the static member variable, so that the method can throw the interrupt exception. The node manager should call the static method, instead of using the static member variable. This fix has an associated benefit: the tests could run faster, because it will no longer need to spawn a bash process when it uses a Shell static method variable (which happens quite often for checking what operating system Hadoop is running on)",-0.3013030303,-0.2529,negative
hadoop,13991,description,"NativeS3FileSystem does not support any retry management for failed uploading to S3. If due to socket timeout or any other network exception, file uploading to S3 bucket fails, then uploading fails and temporary file gets deleted. Connection reset Source) Source) This can be solved by using asynchronous retry management. We have made following modifications to NativeS3FileSystem to add the retry management, which is working fine in our product system, without any uploading failure:",design_debt,non-optimal_design,"Sat, 14 Jan 2017 18:41:34 +0000","Fri, 24 Feb 2017 14:07:36 +0000","Fri, 24 Feb 2017 14:07:36 +0000",3525962,"NativeS3FileSystem does not support any retry management for failed uploading to S3. If due to socket timeout or any other network exception, file uploading to S3 bucket fails, then uploading fails and temporary file gets deleted. java.net.SocketException: Connection reset at java.net.SocketInputStream.read(SocketInputStream.java:196) at java.net.SocketInputStream.read(SocketInputStream.java:122) at org.jets3t.service.S3Service.putObject(S3Service.java:2265) at org.apache.hadoop.fs.s3native.Jets3tNativeFileSystemStore.storeFile(Jets3tNativeFileSystemStore.java:122) at sun.reflect.GeneratedMethodAccessor20.invoke(Unknown Source) at sun.reflect.DelegatingMethodAccessorImpl.invoke(DelegatingMethodAccessorImpl.java:43) at java.lang.reflect.Method.invoke(Method.java:606) at org.apache.hadoop.fs.s3native.$Proxy8.storeFile(Unknown Source) at org.apache.hadoop.fs.s3native.NativeS3FileSystem$NativeS3FsOutputStream.close(NativeS3FileSystem.java:284) at org.apache.hadoop.fs.FSDataOutputStream$PositionCache.close(FSDataOutputStream.java:72) at org.apache.hadoop.fs.FSDataOutputStream.close(FSDataOutputStream.java:106) at org.apache.hadoop.io.compress.bzip2.CBZip2OutputStream.close(CBZip2OutputStream.java:737) at org.apache.hadoop.io.compress.BZip2Codec$BZip2CompressionOutputStream.close(BZip2Codec.java:336) at org.apache.flume.sink.hdfs.HDFSCompressedDataStream.close(HDFSCompressedDataStream.java:155) at org.apache.flume.sink.hdfs.BucketWriter$3.call(BucketWriter.java:312) at org.apache.flume.sink.hdfs.BucketWriter$3.call(BucketWriter.java:308) at org.apache.flume.sink.hdfs.BucketWriter$9$1.run(BucketWriter.java:679) at org.apache.flume.auth.SimpleAuthenticator.execute(SimpleAuthenticator.java:50) at org.apache.flume.sink.hdfs.BucketWriter$9.call(BucketWriter.java:676) This can be solved by using asynchronous retry management. We have made following modifications to NativeS3FileSystem to add the retry management, which is working fine in our product system, without any uploading failure:",0.06666666667,0.002279202279,negative
hadoop,1488,description,"During the last rework of the shuffle, a lot of the stages of the shuffle had auto-progress threads added, leading to system lockups when the shuffle stalls. We need to add Progressables to the sort and fetching interfaces so that if any task gets stuck, it will eventually be killed by the framework.",design_debt,non-optimal_design,"Wed, 13 Jun 2007 17:13:54 +0000","Wed, 8 Jul 2009 16:52:18 +0000","Thu, 28 Jun 2007 21:11:23 +0000",1310249,"During the last rework of the shuffle, a lot of the stages of the shuffle had auto-progress threads added, leading to system lockups when the shuffle stalls. We need to add Progressables to the sort and fetching interfaces so that if any task gets stuck, it will eventually be killed by the framework.",0.2,0.2,negative
hadoop,15577,description,Hello! distcp through 3.1.0 appears to copy files and then rename them into their final/destination filename. added support for more efficient S3 committers that do not use renames. Please update distcp to use these efficient committers and no renames. Thanks!,design_debt,non-optimal_design,"Mon, 2 Jul 2018 22:14:48 +0000","Tue, 3 Jul 2018 14:20:20 +0000","Tue, 3 Jul 2018 14:20:20 +0000",57932,Hello! distcp through 3.1.0 appears to copy files and then rename them into their final/destination filename. https://issues.apache.org/jira/browse/HADOOP-13786added support for more efficient S3 committers that do not use renames. Please update distcp to use these efficient committers and no renames. Thanks!,0.2,0.2,positive
hadoop,1586,description,"Currently, in the loop of MAX_RETRIES (set to three) attempts are made to report progress/ping or All attempt failures are counted as critical. Here I am proposing a variant - treat only ConnectException exceptions are critical and treat the others as non-critical. The other exception could be the in the case of the two RPCs. The reason why I am proposing this is that since HADOOP-1462 went in, I have been seeing quite a few unexpected 65 deaths, and with some logging it appears that they happen, most of the time, due to the in the progress RPC call (before HADOOP-1462, the return value of progress would not be checked). And when the hack described above was put in, things improved considerably. One argument that one might make against the above proposal is that the tasktracker could be faulty, when a task is not able to successfully invoke an RPC on it even though it is able to connect. If this is indeed the case, even in the current scheme of things, the only resort is to restart the tasktracker (either manually, or, the JobTracker asks it to reinitialize), and in both the cases, normal behavior of the protocol will ensure that the child task will die (since the reinited tasktracker is going to return false for the progress/ping calls).",design_debt,non-optimal_design,"Tue, 10 Jul 2007 11:55:01 +0000","Wed, 8 Jul 2009 16:52:18 +0000","Thu, 26 Jul 2007 17:49:18 +0000",1403657,"Currently, in the loop of Task.startCommunicationThread, MAX_RETRIES (set to three) attempts are made to report progress/ping (TaskUmbilicalProtocol.progress or TaskUmbilicalProtocol.ping). All attempt failures are counted as critical. Here I am proposing a variant - treat only ConnectException exceptions are critical and treat the others as non-critical. The other exception could be the SocketTimeoutException in the case of the two RPCs. The reason why I am proposing this is that since HADOOP-1462 went in, I have been seeing quite a few unexpected 65 deaths, and with some logging it appears that they happen, most of the time, due to the SocketTimeoutException in the progress RPC call (before HADOOP-1462, the return value of progress would not be checked). And when the hack described above was put in, things improved considerably. One argument that one might make against the above proposal is that the tasktracker could be faulty, when a task is not able to successfully invoke an RPC on it even though it is able to connect. If this is indeed the case, even in the current scheme of things, the only resort is to restart the tasktracker (either manually, or, the JobTracker asks it to reinitialize), and in both the cases, normal behavior of the protocol will ensure that the child task will die (since the reinited tasktracker is going to return false for the progress/ping calls).",0.03333333333,0.05757575758,neutral
hadoop,16013,description,"sets up a {{Timer}} to schedule a decay of the weights it tracks: However this Timer is not set up as a daemon thread. I have seen this cause my JVM to refuse to exit when running, for example, with FairCallQueue enabled.",design_debt,non-optimal_design,"Tue, 18 Dec 2018 17:55:55 +0000","Tue, 5 Nov 2019 01:19:02 +0000","Fri, 11 Jan 2019 20:58:17 +0000",2084542,"DecayRpcScheduler sets up a Timer to schedule a decay of the weights it tracks: However this Timer is not set up as a daemon thread. I have seen this cause my JVM to refuse to exit when running, for example, NNThroughputBenchmark with FairCallQueue enabled.",-0.2,-0.2,negative
hadoop,16461,description,"The lock now has a ShutdownHook creation, which ends up doing which ends up doing a ""new Configuration()"" within the locked section. This indirectly hurts the cache hit scenarios as well, since if the lock on this is held, then the other section cannot be entered either. slowing down the RawLocalFileSystem when there are other threads creating HDFS FileSystem objects at the same time.",design_debt,non-optimal_design,"Wed, 24 Jul 2019 21:53:03 +0000","Tue, 1 Oct 2019 00:06:38 +0000","Fri, 26 Jul 2019 10:35:00 +0000",132117,"https://github.com/apache/hadoop/blob/2546e6ece240924af2188bb39b3954a4896e4a4f/hadoop-common-project/hadoop-common/src/main/java/org/apache/hadoop/fs/FileSystem.java#L3388 The lock now has a ShutdownHook creation, which ends up doing https://github.com/apache/hadoop/blob/2546e6ece240924af2188bb39b3954a4896e4a4f/hadoop-common-project/hadoop-common/src/main/java/org/apache/hadoop/util/ShutdownHookManager.java#L205 which ends up doing a ""new Configuration()"" within the locked section. This indirectly hurts the cache hit scenarios as well, since if the lock on this is held, then the other section cannot be entered either. https://github.com/apache/tez/blob/master/tez-runtime-library/src/main/java/org/apache/tez/runtime/library/common/sort/impl/TezSpillRecord.java#L65 slowing down the RawLocalFileSystem when there are other threads creating HDFS FileSystem objects at the same time.",-0.05883333333,-0.05883333333,neutral
hadoop,16504,description,"Because default value is too small, TCP's ListenDrop indicator along with the rpc request large. The upper limit of the system's semi-join queue is 65636 and maximum number of fully connected queues is 1024. I think this default value should be adjusted.",design_debt,non-optimal_design,"Sat, 10 Aug 2019 16:46:31 +0000","Wed, 2 Oct 2019 17:16:03 +0000","Thu, 15 Aug 2019 22:21:35 +0000",452104,"Because ipc.server.listen.queue.size default value is too small, TCP's ListenDrop indicator along with the rpc request large. The upper limit of the system's semi-join queue is 65636 and maximum number of fully connected queues is 1024. I think this default value should be adjusted.",-0.125,-0.05357142857,negative
hadoop,16607,description,"Hive deployments can use a JCEKs file to store secrets, which it sets up To be readable only by the Hive user, listing it under When it tries to create an S3A FS instance as another user, via a doAs{} clause, the S3A FS getPassword() call fails on the subsequent -even if the secret it is looking for is in the XML file or, as in the case of encryption settings, or session key undefined. I can you point the blame at hive for this -it's the one with a forbidden JCEKS file on the provider path, but I think it is easiest to fix in S3AUtils than in hive, and safer then changing Configuration. ABFS is likely to see the same problem. I propose an option to set the fallback policy. I initially thought about always handling this: Catching the exception, attempting to downgrade to Reading XML and if that fails rethrowing the caught exception. However, this will do the wrong thing if the option is completely undefined, As is common with the encryption settings. I don't want to simply default to log and continue here though, as it may be a legitimate failure -such as when you really do want to read secrets from such a source. Issue: what fallback policies? * fail: fail fast. today's policy; the default. * ignore: log and continue We could try and be clever in future. To get away with that, we would have to declare which options were considered compulsory and re-throw the caught Exception if no value was found in the XML file. That can be a future enhancement -but it is why I want the policy to be an enumeration, rather than a simple boolean. Tests: should be straightforward; set to a non-existent file and expected to be processed according to the settings.",design_debt,non-optimal_design,"Wed, 25 Sep 2019 14:15:33 +0000","Mon, 18 Nov 2019 19:42:53 +0000","Fri, 11 Oct 2019 15:26:36 +0000",1386663,"Hive deployments can use a JCEKs file to store secrets, which it sets up To be readable only by the Hive user, listing it under hadoop.credential.providers. When it tries to create an S3A FS instance as another user, via a doAs{} clause, the S3A FS getPassword() call fails on the subsequent AccessDeniedException -even if the secret it is looking for is in the XML file or, as in the case of encryption settings, or session key undefined. I can you point the blame at hive for this -it's the one with a forbidden JCEKS file on the provider path, but I think it is easiest to fix in S3AUtils than in hive, and safer then changing Configuration. ABFS is likely to see the same problem. I propose an option to set the fallback policy. I initially thought about always handling this: Catching the exception, attempting to downgrade to Reading XML and if that fails rethrowing the caught exception. However, this will do the wrong thing if the option is completely undefined, As is common with the encryption settings. I don't want to simply default to log and continue here though, as it may be a legitimate failure -such as when you really do want to read secrets from such a source. Issue: what fallback policies? fail: fail fast. today's policy; the default. ignore: log and continue We could try and be clever in future. To get away with that, we would have to declare which options were considered compulsory and re-throw the caught Exception if no value was found in the XML file. That can be a future enhancement -but it is why I want the policy to be an enumeration, rather than a simple boolean. Tests: should be straightforward; set hadoop.credential.providers to a non-existent file and expected to be processed according to the settings.",-0.00205952381,-0.00151754386,neutral
hadoop,2208,description,"Currently, We have counter updates from task tracker to job tracker on every heartbeat. Both counter name and the values are updated for every heartbeat. This can be improved by sending names and values for the first time and only the values after that. The frequency can be reduced by doing update only when the counters got changed.",design_debt,non-optimal_design,"Thu, 15 Nov 2007 04:47:40 +0000","Wed, 8 Jul 2009 16:52:35 +0000","Thu, 3 Jan 2008 08:16:17 +0000",4246117,"Currently, We have counter updates from task tracker to job tracker on every heartbeat. Both counter name and the values are updated for every heartbeat. This can be improved by sending names and values for the first time and only the values after that. The frequency can be reduced by doing update only when the counters got changed.",-0.0125,-0.0125,neutral
hadoop,2897,description,"Hod currently allows the user to specify and run a hadoop script after allocation, and deallocating as soon as the script is done. For e.g. hod -m 3 -z ~/hadoop.script allocates 3 nodes, and runs ~/hadoop.script, then deallocates This is a convenient way single line wrapper around 4-5 commands that users have to write themselves. We have this because: - hod 0.3 does not provide an easy way to combine these into a single operation, because of the HOD shell. - even in hod 0.4, users have to carefully write some error checking code to make sure their cluster is allocated successfully, before running the script and their HADOOP_CONF_DIR should be set correctly. - users can free up clusters as soon as they are done. The requirements make sense. But having this as part of the core hod interface seems incorrect. The interface should be an orthogonal set of commands that each just do one thing well. The script option should be converted to a simple wrapper that can be part of the hod project. This way, users can enjoy the benefits of not having to write such a script themselves, while the hod codebase can still be clean. One disadvantage if we change this is that users will need to remember one more command. But given hod 0.4 is a new interface anyway, it is better to address now, rather than later. And we can alleviate this a bit by making sure options are consistently named between hod and the wrapper script.",design_debt,non-optimal_design,"Tue, 26 Feb 2008 10:55:37 +0000","Sat, 8 Mar 2008 19:51:07 +0000","Mon, 3 Mar 2008 05:54:18 +0000",500321,"Hod currently allows the user to specify and run a hadoop script after allocation, and deallocating as soon as the script is done. For e.g. hod -m 3 -z ~/hadoop.script allocates 3 nodes, and runs ~/hadoop.script, then deallocates This is a convenient way single line wrapper around 4-5 commands that users have to write themselves. We have this because: hod 0.3 does not provide an easy way to combine these into a single operation, because of the HOD shell. even in hod 0.4, users have to carefully write some error checking code to make sure their cluster is allocated successfully, before running the script and their HADOOP_CONF_DIR should be set correctly. users can free up clusters as soon as they are done. The requirements make sense. But having this as part of the core hod interface seems incorrect. The interface should be an orthogonal set of commands that each just do one thing well. The script option should be converted to a simple wrapper that can be part of the hod project. This way, users can enjoy the benefits of not having to write such a script themselves, while the hod codebase can still be clean. One disadvantage if we change this is that users will need to remember one more command. But given hod 0.4 is a new interface anyway, it is better to address now, rather than later. And we can alleviate this a bit by making sure options are consistently named between hod and the wrapper script.",0.1542051282,0.1347833333,neutral
hadoop,3087,description,"JobInfo object is not refreshed in loadHistory.jsp if same job is accessed again. In loadhistory.jsp, the jobInfo object is stored as session attribute. And if the same job is accessed again, the object is not refreshed. This becomes a problem if first time the object accessed was during job running and it doesnt refresh even after completing the job.",design_debt,non-optimal_design,"Tue, 25 Mar 2008 07:04:48 +0000","Wed, 8 Jul 2009 16:52:41 +0000","Thu, 27 Mar 2008 12:36:32 +0000",192704,"JobInfo object is not refreshed in loadHistory.jsp if same job is accessed again. In loadhistory.jsp, the jobInfo object is stored as session attribute. And if the same job is accessed again, the object is not refreshed. This becomes a problem if first time the object accessed was during job running and it doesnt refresh even after completing the job.",-0.3518888889,-0.3518888889,neutral
hadoop,3286,description,"Gridmix jobs use time suffix to differentiate output dir names. The current time granularity of second may not be sufficient, causing multiple jobs having the same output dir.",design_debt,non-optimal_design,"Mon, 21 Apr 2008 01:51:44 +0000","Wed, 21 May 2008 20:06:03 +0000","Wed, 23 Apr 2008 01:05:53 +0000",170049,"Gridmix jobs use time suffix to differentiate output dir names. The current time granularity of second may not be sufficient, causing multiple jobs having the same output dir.",0.0625,0.0625,neutral
