project,issue_number,issue_type,text,classification,indicator,zz_created,zz_updated,zz_resolved,zz_duration,zz_text,zz_wink_a,zz_wink_b,roberta
impala,6601,description,"ASAN fails with in during  - Im assigning this to you thinking you might have an idea whats going on here; feel free to find another person or assign back to me if you're swamped. Ive seen this happen in a private Jenkins run. Please ping me if you would like access to the build artifacts. I saw this in builds that also had issues during the e2e tests, so I'm not sure whether this is flaky or reproducibly broken.",test_debt,flaky_test,"Sat, 3 Mar 2018 01:55:02 +0000","Tue, 6 Mar 2018 17:34:44 +0000","Tue, 6 Mar 2018 17:34:44 +0000",315582,"ASAN fails with memcpy-param-overlap in {{impala::RawValue::Write during RowBatchSerializeTest.RowBatchLZ4Success: joemcdonnell - Im assigning this to you thinking you might have an idea whats going on here; feel free to find another person or assign back to me if you're swamped. Ive seen this happen in a private Jenkins run. Please ping me if you would like access to the build artifacts. I saw this in builds that also had issues during the e2e tests, so I'm not sure whether this is flaky or reproducibly broken.",0.125,0.07,negative
impala,8168,description,"Currently we enable Sentry HDFS sync when running on S3 which sometimes can make the authorization tests on S3 flaky. Since HDFS sync is not supported on S3, we should update our build script to only enable Sentry HDFS sync on HDFS and not on S3.",test_debt,flaky_test,"Wed, 6 Feb 2019 17:57:04 +0000","Thu, 14 Mar 2019 14:04:21 +0000","Fri, 22 Feb 2019 00:12:41 +0000",1318537,"Currently we enable Sentry HDFS sync when running on S3 which sometimes can make the authorization tests on S3 flaky. Since HDFS sync is not supported on S3, we should update our build script to only enable Sentry HDFS sync on HDFS and not on S3.",0.3875,0.3875,neutral
impala,8248,description,We have authorization tests that are specific to Sentry and authorization tests that can be applicable to any authorization provider. We need to re-organize the authorization tests to easily differentiate between Sentry-specific tests vs generic authorization tests. This also will improve test coverage for Ranger.,test_debt,low_coverage,"Tue, 26 Feb 2019 06:59:59 +0000","Tue, 28 May 2019 10:26:13 +0000","Fri, 24 May 2019 20:39:06 +0000",7565947,We have authorization tests that are specific to Sentry and authorization tests that can be applicable to any authorization provider. We need to re-organize the authorization tests to easily differentiate between Sentry-specific tests vs generic authorization tests. This also will improve test coverage for Ranger.,0.3,0.3,neutral
impala,8857,description,"I believe this is a flaky tests, since there's no attempt to pass the timestamp from the kudu client that did the insert to the impala client that's doing the reading.",test_debt,flaky_test,"Tue, 13 Aug 2019 00:17:21 +0000","Thu, 9 Apr 2020 16:53:41 +0000","Thu, 9 Apr 2020 16:53:40 +0000",20795779,"I believe this is a flaky tests, since there's no attempt to pass the timestamp from the kudu client that did the insert to the impala client that's doing the reading.",0.0,0.0,negative
thrift,228,description,"Following exception is raised by the read_message_begin method"" Missing version identifier from `receive_message' Comparing the implementation of the method in the Ruby class to its python counterpart TBinaryProtocol shows that the Ruby method is quite outdated. I have changed the method to be: def read_message_begin version = read_i32 if(version <0) if (version & VERSION_MASK != VERSION_1) raise 'Missing version identifier') end type = version & 0000000ff name = read_string seqid = read_i32 else name = type = read_byte seqid = read_i32 end [name, type, seqid] end This does not raise an exception on the strict read condition in the else clause as is raised by the Python version but can be easily added to.",architecture_debt,using_obsolete_technology,"Sun, 7 Dec 2008 20:13:15 +0000","Tue, 1 Nov 2011 02:51:49 +0000","Mon, 16 Mar 2009 04:38:52 +0000",8497537,"Following exception is raised by the read_message_begin method"" /usr/local/lib/site_ruby/1.8/thrift/protocol/binaryprotocol.rb:82:in 'read_message_begin': Missing version identifier (Thrift::ProtocolException) from /usr/local/lib/site_ruby/1.8/thrift/client.rb:26:in `receive_message' Comparing the implementation of the method in the Ruby class Thrift::BinaryProtocol to its python counterpart TBinaryProtocol shows that the Ruby method is quite outdated. I have changed the method to be: def read_message_begin version = read_i32 if(version <0) if (version & VERSION_MASK != VERSION_1) raise ProtocolException.new(ProtocolException::BAD_VERSION, 'Missing version identifier') end type = version & 0000000ff name = read_string seqid = read_i32 else name = trans.readAll(version) type = read_byte seqid = read_i32 end [name, type, seqid] end This does not raise an exception on the strict read condition in the else clause as is raised by the Python version but can be easily added to.",-0.2666666667,-0.05714285714,negative
thrift,4069,description,"Currently our perl package module files contain multiple packages. We should break each package out to an individual file (or at least make sure everything is in the Thrift namespace) and properly version it. Package versioning was introduced in Perl 5.10 so: 1. Update the minimum required perl to 5.10. This is based on indicating that perl version object was added to perl in 5.10. 2. For each package use the {{perl MODULE VERSION}} perlmod syntax, where VERSION is {{v0.11.0}}. This is based on 3. Each module not under the Thrift namespace must be moved there TMessageType, TType). This will be a breaking change, but necessary for proper packaging of the library. Currently if you inspect the Perl PAUSE version metadata for Thrift's sub-modules only the 0.9.0 modules from gslin have version identities. For example if you look at Thrift and in the CPAN list of packages at you will see: There are some anomalies, for example packages defined in Thrift.pm come out at the top level namespace like: So technically if you do 'install I would expect you might get thrift. This is wrong and should be fixed. needs to be inside Thrift, not at the top level. Also we should pull in relevant changes from the patch in THRIFT-4059 around improving packaging. Also we should actually use TProtocolException and TTransportException instead of just TException everywhere.",architecture_debt,violation_of_modularity,"Sun, 5 Feb 2017 16:20:39 +0000","Thu, 14 Dec 2017 13:54:42 +0000","Thu, 30 Mar 2017 21:12:02 +0000",4596683,"Currently our perl package module files contain multiple packages. We should break each package out to an individual file (or at least make sure everything is in the Thrift namespace) and properly version it. Package versioning was introduced in Perl 5.10 so: 1. Update the minimum required perl to 5.10. This is based on http://search.cpan.org/~jpeacock/version-0.9917/lib/version.pod indicating that perl version object was added to perl in 5.10. 2. For each package use the perl MODULE VERSION perlmod syntax, where VERSION is v0.11.0. This is based on http://perldoc.perl.org/functions/package.html. 3. Each module not under the Thrift namespace must be moved there (TApplicationException, TMessageType, TType). This will be a breaking change, but necessary for proper packaging of the library. Currently if you inspect the Perl PAUSE version metadata for Thrift's sub-modules only the 0.9.0 modules from gslin have version identities. For example if you look at Thrift and Thrift::BinaryProtocol in the CPAN list of packages at http://www.cpan.org/modules/02packages.details.txt you will see: There are some anomalies, for example packages defined in Thrift.pm come out at the top level namespace like: So technically if you do 'install TApplicationException' I would expect you might get thrift. This is wrong and should be fixed. TApplicationException needs to be inside Thrift, not at the top level. Also we should pull in relevant changes from the patch in THRIFT-4059 around improving packaging. Also we should actually use TProtocolException and TTransportException instead of just TException everywhere.",-0.01560526316,-0.01560526316,neutral
thrift,4256,description,"Currently, Thrift.cabal has an exact dependency of vector==0.10.12.2, but this version is much, much older than what other packages depend on. This makes it necessary to enable ""allow-newer"", which effectively ignores the dependency, and then breaks when a package is uploaded to hackage, and prevents inclusion of thrift in a stack curated package set. If there's no particular reason for it (and I've been successfully compiling thrift with vector==0.12.0.2), could this dependency be set to a range, .e.g. >=0.12.0? I could then enter a request for thrift to be added to stack's curated package sets.",architecture_debt,using_obsolete_technology,"Wed, 19 Jul 2017 01:05:49 +0000","Thu, 12 Oct 2017 09:39:39 +0000","Wed, 19 Jul 2017 15:21:19 +0000",51330,"Currently, Thrift.cabal has an exact dependency of vector==0.10.12.2, but this version is much, much older than what other packages depend on. This makes it necessary to enable ""allow-newer"", which effectively ignores the dependency, and then breaks when a package is uploaded to hackage, and prevents inclusion of thrift in a stack curated package set. If there's no particular reason for it (and I've been successfully compiling thrift with vector==0.12.0.2), could this dependency be set to a range, .e.g. >=0.12.0? I could then enter a request for thrift to be added to stack's curated package sets.",-0.004777777778,-0.004777777778,neutral
thrift,4321,description,"Current library is still using old project structure (project.json) which is slightly outdated and needs to be migrated to new MSBuild format. In addition to that, I'd like to have separate packages build for different .NET Standard versions starting from 1.4 (UWP) and up to 2.0 with full feature set.",architecture_debt,using_obsolete_technology,"Fri, 8 Sep 2017 09:34:56 +0000","Sat, 2 Feb 2019 13:47:58 +0000","Thu, 19 Oct 2017 13:10:30 +0000",3555334,"Current library is still using old project structure (project.json) which is slightly outdated and needs to be migrated to new MSBuild format. In addition to that, I'd like to have separate packages build for different .NET Standard versions starting from 1.4 (UWP) and up to 2.0 with full feature set.",0.07025,0.07025,neutral
thrift,4369,description,"ws@0.4.32 is very dangerous, please upgrade it.",architecture_debt,using_obsolete_technology,"Tue, 24 Oct 2017 18:17:34 +0000","Tue, 6 Mar 2018 21:04:38 +0000","Tue, 6 Mar 2018 21:04:00 +0000",11501186,"https://snyk.io/vuln/npm:ws:20160104, https://nodesecurity.io/advisories/67, https://snyk.io/vuln/npm:ws:20160624, https://nodesecurity.io/advisories/120, https://snyk.io/vuln/npm:ws:20160920 ws@0.4.32 is very dangerous, please upgrade it.",-0.004166666667,-0.004166666667,negative
thrift,525,description,"The C# Library Solution fails to compile because of problems with the PreBuildEvent for the ThriftTest Project - Thrift.exe is called with the outdated -csharp instead of --gen csharp - All of the existing commands in the PreBuildEvent will fail if there's a space in any directory name in the directory tree (such as ""My Documents"" or ""Visual Studio 2008""). - The recursive forced rmdir command will match other directory trees that share a common root (e.g. c:\test\Work\ will be recursively removed if the project is located in c:\test\Work for Thrift\test\csharp) I have attached a patch that replaces the PreBuildEvent in the ThriftTest project file to fix these problems and work with directory trees that contain spaces. As the thrift.exe compiler does NOT accept paths with spaces when surrounded by quotes, my script generates MSDOS 8.3 pathnames to pass to the thrift compiler and it appears to work just fine. This has only been tested on my machine with VS.net pro 2008 and a current thrift checkout",architecture_debt,using_obsolete_technology,"Tue, 23 Jun 2009 16:18:25 +0000","Tue, 1 Nov 2011 02:51:46 +0000","Thu, 2 Jul 2009 20:28:57 +0000",792632,"The C# Library Solution (thrift\lib\csharp\src\Thrift.sln) fails to compile because of problems with the PreBuildEvent for the ThriftTest Project (thrift\test\csharp\ThriftTest\ThriftTest.csproj). Thrift.exe is called with the outdated -csharp instead of --gen csharp All of the existing commands in the PreBuildEvent will fail if there's a space in any directory name in the directory tree (such as ""My Documents"" or ""Visual Studio 2008""). The recursive forced rmdir command will match other directory trees that share a common root (e.g. c:\test\Work\ will be recursively removed if the project is located in c:\test\Work for Thrift\test\csharp) I have attached a patch that replaces the PreBuildEvent in the ThriftTest project file to fix these problems and work with directory trees that contain spaces. As the thrift.exe compiler does NOT accept paths with spaces when surrounded by quotes, my script generates MSDOS 8.3 pathnames to pass to the thrift compiler and it appears to work just fine. This has only been tested on my machine with VS.net pro 2008 and a current thrift checkout",0.1303777778,0.03385185185,negative
thrift,568,description,"When building thrift python libs on ubuntu, it places the files into site-packages instead of dist-utils",architecture_debt,violation_of_modularity,"Fri, 21 Aug 2009 19:02:02 +0000","Mon, 29 Aug 2011 00:13:10 +0000","Mon, 29 Aug 2011 00:13:10 +0000",63695468,"When building thrift python libs on ubuntu, it places the files into site-packages instead of dist-utils",0.0,0.0,neutral
thrift,1440,description,"A listing of detectable policy problems in the thrift Debian packaging (in contrib/) can be found with a lintian run: I'll note some of them here for posterity. h3. thrift source: libthrift-dev on libthrift0 The libthrift-dev package should have a versioned dependency on libthrift0, i.e., in debian/control: h3. thrift source: build-depends You don't need the ""build-essential"" bit in Build-Depends. h3. thrift-compiler: Syntax is a bit off in debian/control for the Description fields; I'll attach a patch. h3. thrift-compiler: usr/bin/thrift You need a man page for /usr/bin/thrift. h3. python-thrift-dbg: python-thrift-dbg = The python-thrift-dbg package should be in Section: debug. h3. python-thrift-dbg: dir-in-usr-local usr/local/lib/ Debian packages shouldn't be shipping anything in /usr/local; that's supposed to be reserved for the local system admin. There isn't much reason for this anyway; the dirs being shipped by python-thrift-dbg here are empty. h3. libthrift-ruby: libthrift-ruby = The libthrift-ruby package should be in Section: ruby. Also, according to , it looks like Ruby packages are undergoing a name change in the current Debian testing suite. libthrift-ruby probably needs to become ruby-thrift and switch to using gem2deb. h3. libthrift-ruby: This will probably be addressed under THRIFT-1421. h3. libthrift0: libthrift-c-glib0 This is complaining because the package name of a library package should usually reflect the soname of the included library (see [chapter 5 of the Debian Library Packaging for more info). Something is fishy here, though. Did you intend to distribute the c-glib library as ""libthrift0""? If so, where is the cpp library supposed to go? I don't think I see it after a quick search through the packages. h3. php5-thrift: See the lintian explanation for detailed info. Basically, you need some extra Sauce to add a dependency to php5-thrift on a PHP with a compatible API version. h3. libthrift-java: libthrift-java = libthrift-java should be Section: java h3. libthrift-cil: libthrift-cil = libthrift-cil should be Section: cli-mono h3. libthrift-cil: Thrift.dll shouldn't have its executable bit set. h3. libthrift-perl: usr/usr/ Yeah, installing into /usr/usr/local/lib is kinda wacko. Ought to be /usr/lib. - And as a final note, a lot of the packaging here could be pretty greatly simplified and better future-proofed using the Debhelper 7 command sequencer (""{{dh}}"").",build_debt,under-declared_dependencies,"Mon, 28 Nov 2011 22:14:06 +0000","Thu, 20 Jun 2013 16:12:38 +0000","Thu, 20 Jun 2013 16:12:38 +0000",49226312,"A listing of detectable policy problems in the thrift Debian packaging (in contrib/) can be found with a lintian run: I'll note some of them here for posterity. thrift source: weak-library-dev-dependency libthrift-dev on libthrift0 The libthrift-dev package should have a versioned dependency on libthrift0, i.e., in debian/control: thrift source: build-depends-on-build-essential build-depends You don't need the ""build-essential"" bit in Build-Depends. thrift-compiler: description-contains-invalid-control-statement Syntax is a bit off in debian/control for the Description fields; I'll attach a patch. thrift-compiler: binary-without-manpage usr/bin/thrift You need a man page for /usr/bin/thrift. python-thrift-dbg: wrong-section-according-to-package-name python-thrift-dbg => debug The python-thrift-dbg package should be in Section: debug. python-thrift-dbg: dir-in-usr-local usr/local/lib/ Debian packages shouldn't be shipping anything in /usr/local; that's supposed to be reserved for the local system admin. There isn't much reason for this anyway; the dirs being shipped by python-thrift-dbg here are empty. libthrift-ruby: wrong-section-according-to-package-name libthrift-ruby => ruby The libthrift-ruby package should be in Section: ruby. Also, according to http://wiki.debian.org/Teams/Ruby/Packaging , it looks like Ruby packages are undergoing a name change in the current Debian testing suite. libthrift-ruby probably needs to become ruby-thrift and switch to using gem2deb. libthrift-ruby: empty-binary-package This will probably be addressed under THRIFT-1421. libthrift0: package-name-doesnt-match-sonames libthrift-c-glib0 This is complaining because the package name of a library package should usually reflect the soname of the included library (see chapter 5 of the Debian Library Packaging Guide for more info). Something is fishy here, though. Did you intend to distribute the c-glib library as ""libthrift0""? If so, where is the cpp library supposed to go? I don't think I see it after a quick search through the packages. php5-thrift: missing-dependency-on-phpapi See the lintian explanation for detailed info. Basically, you need some extra Sauce to add a dependency to php5-thrift on a PHP with a compatible API version. libthrift-java: wrong-section-according-to-package-name libthrift-java => java libthrift-java should be Section: java libthrift-cil: wrong-section-according-to-package-name libthrift-cil => cli-mono libthrift-cil should be Section: cli-mono libthrift-cil: executable-not-elf-or-script ./usr/lib/cli/thrift/Thrift.dll Thrift.dll shouldn't have its executable bit set. libthrift-perl: non-standard-dir-in-usr usr/usr/ Yeah, installing into /usr/usr/local/lib is kinda wacko. Ought to be /usr/lib. And as a final note, a lot of the packaging here could be pretty greatly simplified and better future-proofed using the Debhelper 7 command sequencer (""dh"").",0.06018518519,0.08583333333,neutral
thrift,1504,description,"The Cocoa generator imports various thrift files as global imports instead of local importss. This ends up requiring that the user alter their header search paths to include the directories the generated thrift code is in, or the user has to edit the generated files to remove this. e.g. #import <TProtocol.h#import <TProcessor.h vs. #import ""TProtocol.h"" #import #import ""TProtocolUtil.h"" #import ""TProcessor.h""",build_debt,build_others,"Wed, 25 Jan 2012 20:41:06 +0000","Fri, 27 Jan 2012 04:13:57 +0000","Fri, 27 Jan 2012 03:08:57 +0000",109671,"The Cocoa generator imports various thrift files as global imports instead of local importss. This ends up requiring that the user alter their header search paths to include the directories the generated thrift code is in, or the user has to edit the generated files to remove this. e.g. #import <TProtocol.h> #import <TApplicationException.h> #import <TProtocolUtil.h> #import <TProcessor.h> vs. #import ""TProtocol.h"" #import ""TApplicationException.h"" #import ""TProtocolUtil.h"" #import ""TProcessor.h""",0.0,0.0,neutral
thrift,1661,description,"In MacPorts we don't want packages to pick up dependencies unless explicitly instructed to, so it's useful to explicitly turn off Qt support otherwise it'll find Qt4 even though the package doesn't list it as a dependency. I chose --with-qt4 since Qt5 will be out soon and I don't know if this code is supported in Qt5.",build_debt,over-declared_dependencies,"Fri, 27 Jul 2012 01:31:50 +0000","Fri, 27 Jul 2012 16:40:07 +0000","Fri, 27 Jul 2012 16:02:54 +0000",52264,"In MacPorts we don't want packages to pick up dependencies unless explicitly instructed to, so it's useful to explicitly turn off Qt support otherwise it'll find Qt4 even though the package doesn't list it as a dependency. I chose --with-qt4 since Qt5 will be out soon and I don't know if this code is supported in Qt5.",-0.08333333333,-0.08333333333,neutral
thrift,1919,description,"I believe this is the same issue as THRIFT-1693, but with different versions. There's a direct dependency on both httpclient and httpcore version 4.1.3 in thriftlib, but httpclient:4.1.3 has a dependency on httpcore:4.1.4. Here are the dependencies Gradle shows me. Here's a copy of the dependency resolution section of my Gradle build in case anyone needs a short term workaround. The force option is what allows the direct dependency to be overridden to 4.1.4 (shown with a * in the above snippet).",build_debt,build_others,"Sun, 7 Apr 2013 03:43:29 +0000","Fri, 21 Jun 2013 20:55:45 +0000","Fri, 21 Jun 2013 19:37:56 +0000",6537267,"I believe this is the same issue as THRIFT-1693, but with different versions. There's a direct dependency on both httpclient and httpcore version 4.1.3 in thriftlib, but httpclient:4.1.3 has a dependency on httpcore:4.1.4. Here are the dependencies Gradle shows me. Here's a copy of the dependency resolution section of my Gradle build in case anyone needs a short term workaround. The force option is what allows the direct dependency to be overridden to 4.1.4 (shown with a * in the above snippet).",0.08,0.08,neutral
thrift,2150,description,"As ""windows/config.h"" includes Winsock2.h, is it not best practise to define before it: This is in case someone includes Windows.h, which automatically includes the incompatible Winsock.h. It also reduces the size of the Win32 header files which helps compilation speeds :)",build_debt,build_others,"Mon, 26 Aug 2013 12:29:13 +0000","Wed, 6 May 2015 13:19:11 +0000","Wed, 6 May 2015 13:19:10 +0000",53398197,"As ""windows/config.h"" includes Winsock2.h, is it not best practise to define before it: This is in case someone includes Windows.h, which automatically includes the incompatible Winsock.h. It also reduces the size of the Win32 header files which helps compilation speeds",-0.095,-0.095,neutral
thrift,2333,description,"As can be seen in this email message to the users list it is possible for some pre-required packages to be missing, but the traditional method for validating their existence in specfile using ""BuildRequires"" won't work for items that are not commonly available as RPMS. I think that in this user's case the missing bit is the bundler gem, which I have a locally built RPM for, but I have to assume that most folks do not and it is not commonly available in most repos (not that I saw as a Centos6.4 user anyway) The patch I am attaching just checks if ruby subpackage was not disabled at the (at the buildrpm level) and if the results of ./configure have determined that ""make install"" won't build the gem (and so the rpm build of the rubygem-thrift subpackage is bound to fail) abort the build with a clear message An alternative solution MAY be to just dynamically skip that package when it is detected that ./configure excluded ruby (I don't know off hand how to do that)",build_debt,build_others,"Sat, 25 Jan 2014 21:13:20 +0000","Wed, 16 Oct 2019 22:27:23 +0000","Thu, 20 Dec 2018 03:13:32 +0000",154591212,"As can be seen in this email message to the users list it is possible for some pre-required packages to be missing, but the traditional method for validating their existence in specfile using ""BuildRequires"" won't work for items that are not commonly available as RPMS. http://mail-archives.apache.org/mod_mbox/thrift-user/201401.mbox/%3CCACeqxwQrLr7ghoBmbabQpu7z_u0FHjh+vbYXQKwP8=ibR4bHKQ@mail.gmail.com%3E I think that in this user's case the missing bit is the bundler gem, which I have a locally built RPM for, but I have to assume that most folks do not and it is not commonly available in most repos (not that I saw as a Centos6.4 user anyway) The patch I am attaching just checks if ruby subpackage was not disabled at the (at the buildrpm level) and if the results of ./configure have determined that ""make install"" won't build the gem (and so the rpm build of the rubygem-thrift subpackage is bound to fail) abort the build with a clear message An alternative solution MAY be to just dynamically skip that package when it is detected that ./configure excluded ruby (I don't know off hand how to do that)",-0.07,-0.07,neutral
