project,issue_number,issue_type,text,classification,indicator,zz_created,zz_updated,zz_resolved,zz_duration,zz_text,zz_wink_a,zz_wink_b,roberta
hbase,17259,description,"I'm noticing that while I have create and update APIs for quotas, I missed the remove functionality. Need to add public API for that and some tests.",requirement_debt,requirement_partially_implemented,"Mon, 5 Dec 2016 18:01:55 +0000","Fri, 6 Apr 2018 04:00:24 +0000","Mon, 13 Feb 2017 17:30:07 +0000",6046092,"I'm noticing that while I have create and update APIs for quotas, I missed the remove functionality. Need to add public API for that and some tests.",-0.2,-0.2,negative
hbase,17808,description,"FastPath for the FIFO rpcscheduler was introduced in HBASE-16023. But it is not implemented for RW queues. In this issue, I use in RW queues. So anyone who want to isolate their read/write requests can also benefit from the fastpath. I haven't test the performance yet. But since I haven't change any of the core implemention of it should have the same performance in HBASE-16023.",requirement_debt,requirement_partially_implemented,"Mon, 20 Mar 2017 09:13:13 +0000","Wed, 15 Dec 2021 02:48:27 +0000","Wed, 15 Dec 2021 02:48:27 +0000",149535314,"FastPath for the FIFO rpcscheduler was introduced in HBASE-16023. But it is not implemented for RW queues. In this issue, I use FastPathBalancedQueueRpcExecutor in RW queues. So anyone who want to isolate their read/write requests can also benefit from the fastpath. I haven't test the performance yet. But since I haven't change any of the core implemention of FastPathBalancedQueueRpcExecutor, it should have the same performance in HBASE-16023.",0.074,0.074,neutral
hbase,3696,description,"LocalFileSystem in Hadoop doesn't currently implement sync(), so when we're running in that case, we don't have any durability. This isn't a huge deal since it isn't a realistic deployment scenario, but it's probably worth documenting. It caused some confusion for a user when a table disappeared after killing a standalone instance that was hosting its data in the local FS.",requirement_debt,requirement_partially_implemented,"Thu, 24 Mar 2011 01:10:36 +0000","Sun, 12 Jun 2022 00:55:50 +0000","Wed, 28 May 2014 04:08:13 +0000",100321057,"LocalFileSystem in Hadoop doesn't currently implement sync(), so when we're running in that case, we don't have any durability. This isn't a huge deal since it isn't a realistic deployment scenario, but it's probably worth documenting. It caused some confusion for a user when a table disappeared after killing a standalone instance that was hosting its data in the local FS.",-0.1125,-0.1125,negative
hbase,10008,description,"is flakey on Jenkins, this test has failed due to timeout a couple times for me on precommit. Here's the stacktrace.",test_debt,flaky_test,"Wed, 20 Nov 2013 02:44:57 +0000","Fri, 20 Nov 2015 11:53:20 +0000","Thu, 21 Nov 2013 17:28:03 +0000",139386,"TestNamespaceCommands is flakey on Jenkins, this test has failed due to timeout a couple times for me on precommit. Here's the stacktrace.",-0.2,-0.2,negative
hbase,15192,description,"fails intermittently due to failed assertion on cleaned merge region count: Before calling the test does: newcount1 is not cleared at the beginning of the loop. This means that if the check for newcount1 <= 1 doesn't pass the first iteration, it wouldn't pass in subsequent iterations. After timeout is exhausted, is called. However, there is a chance that has been called by the Chore already (during the wait period), leaving the cleaned count 0 and failing the test.",test_debt,flaky_test,"Sat, 30 Jan 2016 00:05:31 +0000","Wed, 24 Feb 2016 06:39:27 +0000","Mon, 8 Feb 2016 23:34:56 +0000",862165,"TestRegionMergeTransactionOnCluster#testCleanMergeReference fails intermittently due to failed assertion on cleaned merge region count: Before calling CatalogJanitor#scan(), the test does: newcount1 is not cleared at the beginning of the loop. This means that if the check for newcount1 <= 1 doesn't pass the first iteration, it wouldn't pass in subsequent iterations. After timeout is exhausted, admin.runCatalogScan() is called. However, there is a chance that CatalogJanitor#scan() has been called by the Chore already (during the wait period), leaving the cleaned count 0 and failing the test.",-0.2,-0.16,negative
hbase,20100,description,"Failed in the nightly in interesting way. A subprocedure of enable table is assigning regions. The test is doing a kill of the procedure store to ensure we can handle all state transtions even in face of failure. In this case, the kill of PE framework came in the finish of the assign procedure AFTER we'd updated hbase:meta and the internal AM state moving Region from OPENING to OPEN. Rerunning this step on restoration of the AMv2 WAL Store results in....",test_debt,low_coverage,"Tue, 27 Feb 2018 19:59:19 +0000","Tue, 7 May 2019 16:08:43 +0000","Thu, 1 Mar 2018 16:55:27 +0000",161768,"Failed in the nightly in interesting way. https://builds.apache.org/job/HBase%20Nightly/job/branch-2/398/ A subprocedure of enable table is assigning regions. The test is doing a kill of the procedure store to ensure we can handle all state transtions even in face of failure. In this case, the kill of PE framework came in the finish of the assign procedure AFTER we'd updated hbase:meta and the internal AM state moving Region from OPENING to OPEN. Rerunning this step on restoration of the AMv2 WAL Store results in....",-0.07333333333,-0.07333333333,neutral
hbase,22424,description,"When running rsgroup test class folder to run all the UTs together, and will flaky. Because TestRSGroupsAdmin1, TestRSGroupsAdmin2 and TestRSGroupsBalance are all extends TestRSGroupsBase, which has a static variable INIT, controlling the initialize of 'master 'group and the number of rs in 'default' rsgroup. Output errors of is shown in HBASE-22420, and will encounter NPE in because `master` group has not been added.",test_debt,flaky_test,"Wed, 15 May 2019 08:47:37 +0000","Fri, 17 May 2019 19:59:26 +0000","Fri, 17 May 2019 01:18:34 +0000",145857,"When running rsgroup test class folder to run all the UTs together, TestRSGroupsAdmin2.testMoveServersAndTables and TestRSGroupsBalance.testGroupBalance will flaky. Because TestRSGroupsAdmin1, TestRSGroupsAdmin2 and TestRSGroupsBalance are all extends TestRSGroupsBase, which has a static variable INIT, controlling the initialize of 'master 'group and the number of rs in 'default' rsgroup. Output errors of TestRSGroupsBalance.testGroupBalance is shown in HBASE-22420, and TestRSGroupsAdmin2.testMoveServersAndTables will encounter NPE in ```rsGroupAdmin.getRSGroupInfo(""master"").containsServer(server.getAddress())``` because `master` group has not been added.",-0.03958333333,0.043125,neutral
hbase,23789,description,"We can't find the balancer rules we just read in the test in high load conditions Test then goes on to fail with: Instead, have tests write rules to local test dir.",test_debt,low_coverage,"Tue, 4 Feb 2020 05:49:24 +0000","Tue, 7 Apr 2020 21:39:02 +0000","Wed, 5 Feb 2020 00:42:09 +0000",67965,"We can't find the balancer rules we just read in the HeterogeneousRegionCountCostFunction test in high load conditions Test then goes on to fail with: Instead, have tests write rules to local test dir.",0.4,0.4,negative
hbase,23867,description,Test has this on it: @Test // Test is flakey. TODO: Fix! Let me cut it down. It runs for a while. It fails nearly every run since HBASE-23865 Up flakey history from 5 to 10 which upped the flakey test so it ran with more fork count.,test_debt,flaky_test,"Wed, 19 Feb 2020 06:38:28 +0000","Tue, 7 Apr 2020 20:38:07 +0000","Wed, 19 Feb 2020 06:42:59 +0000",271,Test has this on it: @Test // Test is flakey. TODO: Fix! Let me cut it down. It runs for a while. It fails nearly every run since HBASE-23865 Up flakey history from 5 to 10 which upped the flakey test so it ran with more fork count.,-0.1292,-0.1292,negative
hbase,4740,description,"Running more frequently seems to show that it has become flaky. It is difficult to tell if this is because of a unrecoverable failure or a recoverable failure. To make this visiable from test and for users, we need to make a change to bulkload call's interface on HRegionServer. The change should make successful rpcs return true, recoverable failures return false, and unrecoverable failure throw an IOException. This is an RPC change, so it would be really good to get this api right before the final 0.92 goes out.",test_debt,flaky_test,"Thu, 3 Nov 2011 17:58:14 +0000","Fri, 20 Nov 2015 11:53:11 +0000","Tue, 8 Nov 2011 14:40:38 +0000",420144,"Running TestHFileOutputFormat more frequently seems to show that it has become flaky. It is difficult to tell if this is because of a unrecoverable failure or a recoverable failure. To make this visiable from test and for users, we need to make a change to bulkload call's interface on HRegionServer. The change should make successful rpcs return true, recoverable failures return false, and unrecoverable failure throw an IOException. This is an RPC change, so it would be really good to get this api right before the final 0.92 goes out.",0.07381428571,0.07381428571,neutral
hbase,5217,description,"At some point we disabled tests for the thrift server. In addition, it looks like the getRegionInfo no longer functions. I'd like to reenable the tests and add one for getRegionInfo. I had to write this to test my changes in HBASE-2600 anyway. I figured I would break it out. We shouldn't commit it until we have fixed getting the regioninfo from the thriftserver.",test_debt,low_coverage,"Tue, 17 Jan 2012 19:17:36 +0000","Sun, 12 Jun 2022 20:10:28 +0000","Wed, 22 Apr 2015 00:33:57 +0000",102834981,"At some point we disabled tests for the thrift server. In addition, it looks like the getRegionInfo no longer functions. I'd like to reenable the tests and add one for getRegionInfo. I had to write this to test my changes in HBASE-2600 anyway. I figured I would break it out. We shouldn't commit it until we have fixed getting the regioninfo from the thriftserver.",-0.03333333333,-0.03333333333,negative
hbase,7172,description,"fails when run individually (run just that test case from eclipse). I've also noticed that it is flaky on windows. The reason is a rare race condition, which somehow does not happen that much when the whole class is run. The sequence of events is smt like this: - we create 1 log file to split - we call in its own thread. - is waiting in since there are no splitlogworkers, it keep waiting. - we delete the task znode from zk - SplitLogManager receives the zk callback from which will call setDone() and mark the task as success. - However, meanwhile the loops sees that remainingInZK == 0, and calls return concurrently to the above. - on return from fails because the znode delete callback has not completed yet. This race only happens when the last task is deleted from zk, and normally only the SplitLogManager deletes the task znodes after processing it, so I don't think this is a production issue.",test_debt,flaky_test,"Fri, 16 Nov 2012 00:38:37 +0000","Tue, 26 Feb 2013 08:23:00 +0000","Wed, 28 Nov 2012 22:41:14 +0000",1116157,"TestSplitLogManager.testVanishingTaskZNode fails when run individually (run just that test case from eclipse). I've also noticed that it is flaky on windows. The reason is a rare race condition, which somehow does not happen that much when the whole class is run. The sequence of events is smt like this: we create 1 log file to split we call splitLogDistributed() in its own thread. splitLogDistributed() is waiting in waitForSplittingCompletion() since there are no splitlogworkers, it keep waiting. we delete the task znode from zk SplitLogManager receives the zk callback from GetDataAsyncCallback, which will call setDone() and mark the task as success. However, meanwhile the waitForSplittingCompletion() loops sees that remainingInZK == 0, and calls return concurrently to the above. on return from waitForSplittingCompletion(), splitLogDistributed() fails because the znode delete callback has not completed yet. This race only happens when the last task is deleted from zk, and normally only the SplitLogManager deletes the task znodes after processing it, so I don't think this is a production issue.",-0.03,0.01,negative
hbase,8256,description,"To make the Jenkin build more useful, it is good to keep it blue/green. We can mark those flaky tests flaky, and don't run them by default. However, people can still run them. We can also set up a Jekin build just for those flaky tests.",test_debt,flaky_test,"Wed, 3 Apr 2013 18:07:36 +0000","Thu, 16 Jun 2022 05:57:12 +0000","Mon, 27 Jan 2014 18:03:21 +0000",25833345,"To make the Jenkin build more useful, it is good to keep it blue/green. We can mark those flaky tests flaky, and don't run them by default. However, people can still run them. We can also set up a Jekin build just for those flaky tests.",0.35475,0.35475,neutral
impala,1120,description,"We should update our code that fetches and updates column stats to use the new bulk APIs introduced in Hive .13. Instead of fetching a single column at a time, we can now fetch stats for a list of column names.",architecture_debt,using_obsolete_technology,"Tue, 29 Jul 2014 00:38:53 +0000","Tue, 13 Jan 2015 18:17:33 +0000","Tue, 13 Jan 2015 18:17:33 +0000",14578720,"We should update our code that fetches and updates column stats to use the new bulk APIs introduced in Hive .13. Instead of fetching a single column at a time, we can now fetch stats for a list of column names.",0.08333333333,0.08333333333,neutral
impala,4652,description,Kudu's utility library depends on We need to add the most recent version to the toolchain.,architecture_debt,using_obsolete_technology,"Mon, 12 Dec 2016 18:43:32 +0000","Thu, 12 Jan 2017 23:51:13 +0000","Thu, 12 Jan 2017 23:51:13 +0000",2696861,Kudu's utility library depends on crcutil. We need to add the most recent version to the toolchain.,0.0,0.0,neutral
impala,6080,description,One of the parts of this patch was cleanup of how descriptor tables were managed. As described in the commit message: That cleanup should be independent of the larger patch so we could get it in separately.,architecture_debt,violation_of_modularity,"Wed, 18 Oct 2017 23:53:05 +0000","Thu, 16 Nov 2017 22:12:16 +0000","Thu, 16 Nov 2017 22:12:16 +0000",2499551,One of the parts of this patch https://gerrit.cloudera.org/#/c/7065/ was cleanup of how descriptor tables were managed. As described in the commit message: That cleanup should be independent of the larger patch so we could get it in separately.,0.1,0.1,neutral
impala,3252,description,There seems to be a configuration file checked in in git that changes every time we do a build. The file is This file should be removed from git.,build_debt,build_others,"Mon, 28 Mar 2016 17:55:33 +0000","Mon, 11 Jun 2018 20:57:57 +0000","Mon, 11 Jun 2018 20:42:56 +0000",69562043,There seems to be a configuration file checked in in git that changes every time we do a build. The file is thirdparty/hadoop-2.6.0-cdh5.8.0-SNAPSHOT/share/hadoop/kms/tomcat/conf/server.xml. This file should be removed from git.,0.0,0.025,negative
impala,3338,description,"The Impala-lzo build depends on the Impala build scripts and headers, but we don't need to do an entire Impala build to produce the Impala-lzo .so. Factor out the build logic from buildall.sh so it can be built independently if needed.",build_debt,build_others,"Wed, 13 Apr 2016 00:50:25 +0000","Tue, 7 Jun 2016 16:19:39 +0000","Tue, 7 Jun 2016 16:19:39 +0000",4807754,"The Impala-lzo build depends on the Impala build scripts and headers, but we don't need to do an entire Impala build to produce the Impala-lzo .so. Factor out the build logic from buildall.sh so it can be built independently if needed.",0.125,0.125,neutral
impala,8862,description,These get bundled into the containers but are not be invoked at runtime. We should be able to avoid including them as dependencies entirely.,build_debt,over-declared_dependencies,"Wed, 14 Aug 2019 18:39:35 +0000","Fri, 16 Aug 2019 17:47:59 +0000","Fri, 16 Aug 2019 17:47:59 +0000",169704,These get bundled into the containers but are not be invoked at runtime. We should be able to avoid including them as dependencies entirely.,0.122,0.122,neutral
impala,1013,description,This function is very simple and goes through the HS2 interface to retrieve a few functions. I believe this used to be instantaneously and now takes hundreds of seconds making this likely unusable.,code_debt,slow_algorithm,"Wed, 21 May 2014 21:54:09 +0000","Wed, 11 Jun 2014 19:22:37 +0000","Wed, 11 Jun 2014 19:22:37 +0000",1805308,This function is very simple and goes through the HS2 interface to retrieve a few functions. I believe this used to be instantaneously and now takes hundreds of seconds making this likely unusable.,-0.2,-0.2,negative
impala,1414,description,"The following query on a relatively small input takes ~70s with codegen and ~35 minutes without codegen, which seems unreasonably long. We should make sure we're not doing anything crazy in the non-codegen eval path. Executing with codegen: The query profile when running without codegen is attached. I also used perf (linux profiling tool) to collect a profile (sampled stacks) and printed the aggregated callstacks to the attached file The summary without codegen. Most of the time (28mins) is spent in the hash joins:",code_debt,slow_algorithm,"Thu, 23 Oct 2014 18:22:13 +0000","Thu, 29 Sep 2016 20:47:33 +0000","Thu, 29 Sep 2016 20:36:09 +0000",61092836,"The following query on a relatively small input takes ~70s with codegen and ~35 minutes without codegen, which seems unreasonably long. We should make sure we're not doing anything crazy in the non-codegen eval path. Executing with codegen: The query profile when running without codegen is attached. I also used perf (linux profiling tool) to collect a profile (sampled stacks) and printed the aggregated callstacks to the attached file perf-histograms.out. The summary without codegen. Most of the time (28mins) is spent in the hash joins:",0.025,0.01785714286,neutral
impala,1466,description,"The catalog cache is cold. Loading the table metadata when I've a single request is fast (within 2sec). However, when I've 100+ concurrent queries all requesting the same table metadata, the loading time extremely long (in 10s of seconds+). This shouldn't be the case. The first request should load the metadata and all subsequent request (even though they're concurrent) should be a no-op.",code_debt,slow_algorithm,"Tue, 11 Nov 2014 19:24:05 +0000","Thu, 26 Jan 2017 01:03:23 +0000","Thu, 26 Jan 2017 01:03:23 +0000",69658758,"The catalog cache is cold. Loading the table metadata when I've a single request is fast (within 2sec). However, when I've 100+ concurrent queries all requesting the same table metadata, the loading time extremely long (in 10s of seconds+). This shouldn't be the case. The first request should load the metadata and all subsequent request (even though they're concurrent) should be a no-op.",0.0,0.0,negative
impala,1552,description,"When running out of memory in PAGG the error message does not make it clear why we ran out of memory. In the example below we see that the limit is 100MB and the consumption is only 8MB, but we ran out of memory. In this particular case, the reason is that PAGG tries to allocate the initial min mem for each partition and fails (each partition needs ~8MB and we have 32 of them). It would be good to improve the error message with some more useful info, e.g. how much more memory was needed. Backend 0:Memory Limit Exceeded Limit: Limit=100.00 MB Consumption=8.03 MB Fragment Consumption=8.00 KB EXCHANGE_NODE (id=5): Consumption=0 DataStreamRecvr: Consumption=0 Block Manager: Consumption=0 Fragment Consumption=4.01 MB SORT_NODE (id=2): Consumption=0 AGGREGATION_NODE (id=4): Consumption=4.00 MB EXCHANGE_NODE (id=3): Consumption=0 DataStreamRecvr: Consumption=0 DataStreamSender: Consumption=4.00 KB Fragment Consumption=4.01 MB AGGREGATION_NODE (id=1): Consumption=4.00 MB HDFS_SCAN_NODE (id=0): Consumption=0 DataStreamSender: Consumption=4.00 KB",code_debt,low_quality_code,"Wed, 26 Nov 2014 02:12:58 +0000","Wed, 4 Jan 2017 23:58:13 +0000","Tue, 8 Sep 2015 16:37:21 +0000",24762263,"When running out of memory in PAGG the error message does not make it clear why we ran out of memory. In the example below we see that the limit is 100MB and the consumption is only 8MB, but we ran out of memory. In this particular case, the reason is that PAGG tries to allocate the initial min mem for each partition and fails (each partition needs ~8MB and we have 32 of them). It would be good to improve the error message with some more useful info, e.g. how much more memory was needed. Backend 0:Memory Limit Exceeded Query(3b428a0f1e22f611:722a79f624fcb0b5) Limit: Limit=100.00 MB Consumption=8.03 MB Fragment 3b428a0f1e22f611:722a79f624fcb0b6: Consumption=8.00 KB EXCHANGE_NODE (id=5): Consumption=0 DataStreamRecvr: Consumption=0 Block Manager: Consumption=0 Fragment 3b428a0f1e22f611:722a79f624fcb0b7: Consumption=4.01 MB SORT_NODE (id=2): Consumption=0 AGGREGATION_NODE (id=4): Consumption=4.00 MB EXCHANGE_NODE (id=3): Consumption=0 DataStreamRecvr: Consumption=0 DataStreamSender: Consumption=4.00 KB Fragment 3b428a0f1e22f611:722a79f624fcb0b8: Consumption=4.01 MB AGGREGATION_NODE (id=1): Consumption=4.00 MB HDFS_SCAN_NODE (id=0): Consumption=0 DataStreamSender: Consumption=4.00 KB",-0.1704857143,-0.1704857143,negative
impala,1577,description,"The performance of from_utc_timestamp, besides being extremely poor compared to that of other builtin functions such as from_unixtime, depends greatly on the input timezone. Given that evaluating this function can dominate the total query time, it would be good to at least make its performance more consistent, and even better to improve its performance overall.",code_debt,slow_algorithm,"Fri, 5 Dec 2014 01:16:08 +0000","Mon, 9 Jul 2018 16:45:30 +0000","Mon, 9 Jul 2018 16:45:30 +0000",113412562,"The performance of from_utc_timestamp, besides being extremely poor compared to that of other builtin functions such as from_unixtime, depends greatly on the input timezone. Given that evaluating this function can dominate the total query time, it would be good to at least make its performance more consistent, and even better to improve its performance overall.",0.07933333333,0.07933333333,negative
impala,1596,description,Some the builtin decimal functions assume they can always use the val16 union field of a DecimalType. This isn't actually a valid assumption though. We should only initialize and use the smaller fields (val4/val8) for performance if possible.,code_debt,low_quality_code,"Wed, 10 Dec 2014 21:10:54 +0000","Tue, 5 May 2015 22:31:37 +0000","Tue, 5 May 2015 22:31:37 +0000",12619243,Some the builtin decimal functions assume they can always use the val16 union field of a DecimalType. This isn't actually a valid assumption though. We should only initialize and use the smaller fields (val4/val8) for performance if possible.,0.0,0.0,negative
impala,1929,description,"While running the mem leak test with 4 concurrent clients using the release bits an impalad crashed at with the following stack trace. This can happen in case of RIGHT_OUTER, RIGHT_ANTI and FULL_OUTER joins when the hash table of the partition is NULL. The code has a dcheck that the hash_tbl is not null, which we didn't hit because we were using the release bits.",code_debt,low_quality_code,"Tue, 31 Mar 2015 23:44:24 +0000","Sun, 20 Dec 2015 00:05:28 +0000","Sun, 19 Jul 2015 02:18:49 +0000",9426865,"While running the mem leak test with 4 concurrent clients using the release bits an impalad crashed at PHJ::NextSpilledProbeRowBatch() with the following stack trace. This can happen in case of RIGHT_OUTER, RIGHT_ANTI and FULL_OUTER joins when the hash table of the partition is NULL. The code has a dcheck that the hash_tbl is not null, which we didn't hit because we were using the release bits.",0.02822222222,0.02822222222,neutral
impala,1963,description,"We have several data sources that return dates in ISO-8601 format. Following IMPALA-648, we are closer to having these convertable to timestamp without effort, but time zones are still not supported: Neither format with a time zone specifier will parse even though they are valid based on my understanding of ISO-8601 and For now we have worked around this by converting with substring to cut off the time zone identifier, but I'm not sure which time zone the dates will be interpreted in. If I cut off the Z, will my dates be parsed in server local time? Ideally, we should be able to cast dates with time zone specifiers to timestamps with cast easily.",code_debt,low_quality_code,"Wed, 22 Apr 2015 15:03:34 +0000","Fri, 5 Jun 2015 04:47:07 +0000","Fri, 5 Jun 2015 04:47:07 +0000",3764613,"We have several data sources that return dates in ISO-8601 format. Following IMPALA-648, we are closer to having these convertable to timestamp without effort, but time zones are still not supported: Neither format with a time zone specifier will parse even though they are valid based on my understanding of ISO-8601 and http://en.wikipedia.org/wiki/ISO_8601 For now we have worked around this by converting with substring to cut off the time zone identifier, but I'm not sure which time zone the dates will be interpreted in. If I cut off the Z, will my dates be parsed in server local time? Ideally, we should be able to cast dates with time zone specifiers to timestamps with cast easily.",0.09541666667,0.09541666667,neutral
